{
  "required" : true ,
  "$schema" : "http://json-schema.org/draft-03/schema" ,
  "type" : "object" ,
  "properties" : {
    "@odata.id" : {
      "type" : "string" ,
      "required" : false
    } ,
    "@odata.editLink" : {
      "type" : "string" ,
      "required" : false
    } ,
    "Id" : {
      "type" : "string" ,
      "required" : false
    } ,
    "Name" : {
      "type" : "string" ,
      "required" : false
    } ,
    "ChangeKey" : {
      "type" : "string" ,
      "required" : false
    } ,
    "ClassId" : {
      "type" : "string" ,
      "required" : false
    } ,
    "Calendars@odata.navigationLink" : {
      "type" : "string" ,
      "required" : false
    }
  }
}