{
  "@odata.id" : "https://outlook.office365.com/EWS/OData/Users('sadie@contoso.com')/CalendarGroups('AQMkAGI3...')" ,
  "@odata.editLink" : "https://outlook.office365.com/EWS/OData/Users('sadie@contoso.com')/CalendarGroups('AQMkAGI3...')" ,
  "Id" : "AQMkAGI3..." ,
  "Name" : "My Calendars" ,
  "ChangeKey" : "R9CVg8njOEeBFPLI1qvQugAAAAAI5A==" ,
  "ClassId" : "0006f0b7-0000-0000-c000-000000000046" ,
  "Calendars@odata.navigationLink" : "https://outlook.office365.com/EWS/OData/Users('sadie@contoso.com')/CalendarGroups('AQMkAGI3...')/Calendars"
}